151940","45906","0","In onRestoreInstanceState, I think you mean for the first line to be super.onRestoreInstanceState rather than super.onSaveInstanceState"
"456941","1231952","20","This is the android.text.format.DateFormat rather than java.text.DateFormat."
"151940","1643029","9","Any chance this works on the phone, but not in the emulator? I cannot seem to get a non-null savedInstanceState."
"2091482","2024535","0","ok if i pass session id to signout acitivity on successful login and  will it work on any activity page to signout or manually i will have to assign it value on each activity??? using above procedure??"
"2091482","2027425","2","Yes, you'd have to make the session ID available to every activity where you want to allow the user to signout.  Alternatively, you could store it in the Application object, but then you'd have to manage the state of the session (check if it's valid before using, etc)."
"2131051","2070403","3","Thanks fixXedd. It worked perfectly."
"2131051","2076525","2","No problem. Happy to help."
"2591311","2599085","3","Great answer. You don't have to do both though, removing the notification bar may be overkill."
"2591311","2606661","41","Thanks but that is not in XML..."
"2644266","2659412","3","I think you may have misread the Question? Janusz already has the custom dialog displaying and just requires information on removing the title"
"2644266","2659476","12","Well, according to the official documentation, ""A dialog made with the base Dialog class must have a title. If you don't call setTitle(), then the space used for the title remains empty, but still visible. If you don't want a title at all, then you should create your custom dialog using the AlertDialog class."" I haven't personally experimented with it, but that would suggest that even using a custom dialog layout or themes, it's impossible to remove the title space."
"2644266","2659530","0","2nd thought: I think we're understanding ""title"" differently. I assume he's talking about the space at the top of the pop-up window, not the title at the top of the app."
"2644266","2659564","0","Not sure, I have an activity in my application with a dialog theme so it appears like a dialog and the code in my answer removes the space at the top of the pop up. I believe I done the same successfully for a custom dialog as in the question but I dont have the code at the min so cant be sure and may not be correct."
"2644266","2660451","0","Ok good try but it is not working. I get: android.view.WindowManager$BadTokenException: Unable to add window -- token null is not for an application 

if I want to shwo the dialog."
"2644266","2660477","0","Edit your question and show us the code you used. The above principle works, I've done it myself, so you must have done something wrong in your implementation. Also, did you read the developer's website instructions or did you just copy/paste?"
"2644266","2662143","0","I have added more info to my answer regarding your new issue, report back if that helps or not"
"2644266","2758240","0","Still now working. The problem is that in the custom dialog page you linked is a title shown that is not created through their xml file. It seems that every dialog needs this title..."
"2644266","2759028","0","@Janusz: Edited my answer."
"2644266","2763902","0","Thanks for the work and trying all that. view.findViewById is working and the dialog has no title."
"823966","2982105","25","Note that 10 may not be the best value for inSampleSize though, the documentation suggests using powers of 2."
"823966","2982277","0","Right. I've edited the answer."
"3035869","3105551","3","Hi Praveen. The drawable I want to set as the wallpaper is not in R.drawable. It is a drawable I downloaded from the web and keep it in an arrayList of type Drawable along with other drawables."
"3035869","3105616","1","i think you have the url values. then my edited answer should help."
"3035869","3105724","0","where does str_url come from? I couldn't find any Drawable function related to strings... thanks for your help."
"3035869","3105841","5","I think I found something: if ""draw"" is the drawable I want to convert to a bitmap then:  

Bitmap bitmap = ((BitmapDrawable)draw).getBitmap();

does the trick!"
"1109108","3186227","4","Thanks this seems to work great if using 0 as the second parameter. But if I use InputMethodManager.HIDE_IMPLICIT_ONLY the keyboard is never hidden (although i'm not holding down menu). Any hints?"
"3145655","3239416","2","Hi Fedor, thanks for that, it looks strikingly similar to what I ended up doing for previous projects.  And that's more or less what prompted this question: surely there must be a simpler way?!"
"3145655","3242514","0","I'm not aware of any simpler way. You can make modifications to my method. For example you may listen to only one provider instead of two. But anyway you need listener, timeout timer."
"3166551","3257139","2","The size in pixels of the display is not the density."
"823966","3303715","49","I'm facing the same problem as Chrispix, but I don't think the solution here really solves the problem, but rather sidesteps it.  Changing the sample size reduces the amount of memory used (at the cost of image quality, which is probably okay for an image preview), but it will not prevent the exception if a large enough image stream is decoded, of if multiple image streams are decoded.

If I find a better solution (and there may not be one) I'll post an answer here."
"456941","3407271","1","It's pretty typical of Android IME to have two classes that both claim to give you a result that is set to the default Locale but one doesn't. So yes, don't forget to use the android.text.format version of DateFormat (that doesn't even derive the java.util one LOL)."
"3145655","3507071","0","One interesting problem I've discovered with this approach is that the TimerTask keeps the activity resident in memory for the duration of the timeout even after the activity has been destroyed.  This was a problem for me when users switched back and forth between landscape and portrait modes, resulting in an eventual OutOfMemory exception if they created enough activities within the 20 second timeout."
"3145655","3524026","0","That's right. ""android:configChanges"" should be specified to avoid activity restart on orientation change. And if you still need to restart activity you should cancel TimerTask or even the complete Timer."
"823966","3580011","2","You only need an appropriate size to match the screen in pixel density, for zooming in and such you can take a sample of the image at a higher density."
"2591311","3631598","166","Be certain to put it *before* the call to setContentView(R.id.x), otherwise it will crash.  The reason wasn't immediately obvious to me.


08-13 12:47:33.561 E/AndroidRuntime( 9125): java.lang.RuntimeException: Unable to start activity ComponentInfo{com.myapp/com.myapp.SplashActivity}: android.util.AndroidRuntimeException: requestFeature() must be called before adding content"
"3495908","3652403","40","You've just recreated a very expensive LinearLayout :)"
"3495908","3755412","50","Except a `LinearLayout` doesn't have all the inherent niceties of a `ListView` -- it doesn't have dividers, header/footer views, a list selector which matches the phone's UI theme colors, etc.  Honestly, there's no reason why you can't scroll the inner container until it's reached the end and then have it stop intercepting touch events so that the outer container scrolls.  Every desktop browser does this when you're using your scroll wheel.  Android itself can handle nested scrolling if you're navigating via the trackball, so why not via touch?"
"3624311","3807438","7","+1, but use getPreferences(MODE_PRIVATE); instead of getPreferences(0); for readability."
"3624311","3807448","0","What is mSaved here? I need to save 2 string values."
"3292810","3834140","1","This should be picked as the answer. Thank you George!"
"3916700","4186980","3","Thanks for your reply, u r right, it works. but I have different issue. I am not loading an image, loading the webpage in the webview, So how to find out the webpage width (PIC_WIDTH)."
"3916700","4189348","0","Ah, I missed that constant in there.  Sorry about that.  I am not sure how you can get the width of the actual webpage."
"559781","4194171","0","Thanks for sharing the code!"
"823966","4469340","11","instead of scale++ you should use scale *= 2;"
"2091482","4553158","0","like the simple approach"
"3145655","4565221","3","For the record, my understanding is that google generally recommends against using android:configChanges.  Instead I've gone with a solution that registers the timertasks and cancels them onDestroy."
"151940","4669772","4","I have an ArrayList of points how to save all points in this array list and then restore them?"
"2636538","4856210","0","It doesn't work when I use Astro file manager. Any ideas why?"
"2636538","4885883","4","@rohith - look at my answer"
"456941","4973591","0","am having problem with what i should import - i mean lib files :("
"559781","5215402","79","I think you should use SoftReferences so that your program will never cause OutOfMemoryException. As GC can clear softreferences when heap size is increasing... you can manage your own generation like after some seconds you can put your images to that list and before loading you should check that if image exists then don't  download it again rather collect it from that list and also putting it back to your softref list and after sometime you can purge your hardlist :)"
"559781","5215415","23","Google Shelves project is an excellent example look how they did http://code.google.com/p/shelves/"
"2418314","5315150","2","How would I do it using the AlertDialog.Builder? ...final AlertDialog.Builder alert = new AlertDialog.Builder(Main.this);"
"1109108","5614955","5","Cool. Just to clarify, this only dismisses it if present, but won't *prevent* it from popping up, right?"
"5106399","5724574","1","If I do this, the soft-keyboard is shown when the activity appears (it's good) but when my focus leave the EditText and go to a Button for example, the keyboard stays (that's bad)."
"5106399","5725406","0","ill edit the answer"
"5106399","5726140","0","So, I need to check my EditText focus, there is no automatic way to do that. I think it's just because the android philosophy about the keyboard is different than the Apple one on the iPhone."
"5106399","5726609","0","so, does this help your problem?"
"2318356","5900260","0","Is this code going to handle the case where the phone doesn't have an accelerometer? I don't have a device without one and the emulator doesn't work so I was hoping somebody might be in the know about this subject."
"5185587","5905672","1","This will work, but only for `TextView`. It will require custom subclasses for every widget class that inherits from `TextView` where the same capability is desired."
"3292810","6085670","0","Really simple and useful."
"151940","6136623","0","@Shaun: It does, Fragments have an onSaveInstanceState handler as well."
"151940","6142638","0","But it doesnt have an onRestoreInstanceState, which really makes the onSaveInstanceState useless in this example"
"559781","6213963","11","Don't you miss a return when drawableMap contains the image ... without starting the fetching-thread?"
"823966","6222384","4","Terrific.Its working very good.Thanks Fedor"
"5535672","6316309","3","This is actually the best solution I've seen yet, very well done. It's not completely suited to my needs because of the way Android likes to break words when wrapping, so I'll be sticking with my custom solution- but your class is much better for general use."
"823966","6337635","1","Can anyone explain what the REQUIRED_SIZE corresponds to? Is that pixels of one side, dips? Thanks!"
"823966","6342422","1","REQUIRED_SIZE is the new size you want to scale to."
"151940","6449064","291","CAREFUL: you need to call  super.onSaveInstanceState(savedInstanceState) before adding your values to the Bundle, or they will get wiped out on that call (Droid X Android 2.2)."
"1109108","6496911","0","@Roflcoptr - hideImplicitOnly is only when the keyboard automatically opens when an editText gets focus. In your situation, you may be pressing on the editText, indicating that you want to type in it, which is an explicit action."
"5763338","6600265","1","This only hides the bars I guess.. but not the effect of the scrollview"
"5763338","6600535","0","it won't allow you to scroll also it will not hide gallery view"
"5763815","6601804","0","Here is how the class looks: http://pastebin.com/dsWSWR4x  But I get the error 'The method onTouch(View, MotionEvent) of type LockableScrollView must override or implement a supertype method'"
"5763815","6603001","0","Apologies, corrected the errors in my code - it should have been `onTouchEvent(MotionEvent ev)`"
"5763815","6609280","0","Ok now the code complies, though when I run the app it crashes... and when i remove this class and return the <ScrollView instead of your class the app works fine!"
"5763815","6609509","0","Hi Omar could you post the error you get? Make sure change the com.mypackagename in <com.mypackagename.LockableScrollView> to your own one"
"5763815","6611374","0","At the end I was able to get it to work, though I run into other issues so I used a dirty fix by having 2 Galleries, one within the scrollview and the other out, and i will just hide/unhide them.. thanks for your time though"
"3427058","6707298","0","your method very well ,but i found that i choice one item ,not only the text of the item,but also the  choice icon  are show at the spinner"
"5626213","6767996","1","What permissions are required for an app to use this?"
"4737265","6925960","39","This wasn't working for me until I realized that you must set the following attribute on your activity: android:windowSoftInputMode=""adjustResize"""
"5185587","6960418","0","I need more help regarding this solution, Could anybody please provide.???"
"6070857","7030395","3","Should this line: `return super.onKeyDown(keyCode, event);` be in onKeyDown or am I imagining? :P"
"6070857","7030502","0","Typo, thanks for catching"
"6070857","7030583","0","We both are working for same community.
You're welcome jen.
:)"
"6070857","7030947","0","you also +1...."
"6070857","7061095","5","Thanks for your answer. (I upped the other answer too). Tip: you can avoid subclassing by just editText.setOnKeyListener(...) and return (keyCode == KeyEvent.KEYCODE_ENTER)."
"1109108","7068676","1","Of course you will need to set this back.  Please verify how to undo this change."
"559781","7127927","1","Yesterday I upvoted you because from your code , I learnt how to get a drawable from url, and today I learnt lazy loading from you, seriously, you are the man..... u saved my life ..."
"3145655","7237100","0","Hi, I have tried using this code but it never gives the location from gpslistener and even getLastKnownLocation for GPS returns null everytime though it works fine for networklistener. I have setted up the user-permission for ""access_fine_location"". I am trying on actual device and not on emulator(GPS is enabled). Is there something I might be doing wrong?"
"3145655","7257611","2","Used this class in my simple app and it works like a champ.  Thanks for posting it!"
"4737265","7284425","0","thank you for this. it works like a charm."
"3916700","7325030","1","What is PIC_WIDTH here ?"
"6290587","7345929","0","Hi! Thanks for your response! So, meaning, I ave 5 editTexts, I have to do that for 5 times??"
"6290587","7345960","0","not necessarily, that could be a function"
"6290587","7346012","1","yes sorry, forgot that you had five. You could make a function that did the same thing and call it five times - or you could loop over the five EditText's."
"6330456","7404335","0","User is showing his first screen as home screen,thats the main issue."
"6330456","7404634","0","well as i have it my response you need to get back to the home screen and finish that one. so the process call the intent above from any screen. receive the intent on the Home screen and instantly lauch a intent towards login and finish home after the startActivity method. you can also override the pending animation to null for in and out so that it doesn't show the transition ( i do that because it feels kinda quicker).so that should be working fine for the thing you need."
"6330456","7404686","0","Clear top will work for clearing everything above the activity you are calling with the intent. so this means since activities are stacking above home they will be cleared. its just a matter of starting the login activity afterwards. i have been using it like that and i had no issues with it. also you need to declare the activity to have a single instance so you dont accidently launch another instance of the home activity (which then would be on top and wont clear things below)"
"6330456","7405141","3","Rather than declare the activity as `singleInstance`, consider using `FLAG_ACTIVITY_CLEAR_TOP|FLAG_ACTIVITY_SINGLE_TOP` as the flags for the Intent. This will finish intervening activities and start (or bring back to the foreground) the desired activity."
"6330456","7405577","0","Yeah @CommonsWare is right. i didn't think of that. but still as a discussion maybe: why not actually declare the activity singleTop/singleInstance? its the home activity. i don't think there would be a reason at any point to have 2 instances of that one right?"
"6330456","7405712","0","@DArkO: Few apps need a `singleInstance` activity -- that's mostly for home screens. You can declare `singleTop` if you want; I personally prefer to manage that at the `Intent` level."
"6330456","7405990","5","@ CommonsWare  Adding `intent.addFlags(Intent.FLAG_ACTIVITY_CLEAR_TOP|Intent.FLAG_ACTIVITY_SINGLE_TOP);` to my activity did not help me.It did not finish the intervening  activities.When I press back from the Login screen I can see the previous activities.Here is my code `Intent  intent=new Intent(BaseActivity.this, Login.class);intent.addFlags(Intent.FLAG_ACTIVITY_CLEAR_TOP|Intent.FLAG_ACTIVITY_SINGLE_TOP);startActivity(intent);`."
"6330456","7406101","0","@CommonsWare ok that seems reasonable. but from my experience singleTop solves some cases where you forget to add the Single top flag and also when working in a team than its more of a coding convention whether to use the flag or the manifest declaration. nvm lets get back to this question. @Tanmay Mandal you shouldnt launch the login activity because it will launch it on top of the others since it is created from scratch when you call the intent. what i said was to actually launch the home activity and from it launch the Login and finish the home. that will clear the Top activities."
"6330456","7406143","0","@DArkO I think thats the solution I need to implement.calling the home and then finish it and call the login.let me try it."
"6343299","7422419","5","Shows an error -The type RetreiveFeedTask must implement the inherited abstract method AsyncTask<String,Void,RssFeed>.doInBackground(String...)"
"6343299","7430435","0","Can you post the full error?"
"6343299","7435177","1","shows an error-The type RetreiveFeedTask must implement the inherited abstract method AsyncTask<String,Void,RssFeed>.doInBackground(String...) when using the abstract method it shows another error - Cannot instantiate the type RetreiveFeedTask"
"6343299","7435511","0","Please try to use the updated code (I've validated it in the ADT)"
"6343299","7435628","0","Its again shows the error : - The type RetreiveFeedTask must implement the inherited abstract method AsyncTask<String,Void,RssFeed>.doInBackground(String...)"
"6343299","7435720","0","What Android version are you using? What IDE?"
"6343299","7435769","0","SDK Platform Android 3.1,API 12, Revision 2                             Eclipse SDK - 3.6.2"
"6343299","7436007","0","Android API level 12 still has the same AsyncTask signature: http://developer.android.com/reference/android/os/AsyncTask.html Please check that the code was copied into your IDE without mistakes."
"6343299","7460321","1","private RssFeed getFeed(String urlToRssFeed)
	    {try
	    	{	 new RetreiveFeedTask().execute(urlToRssFeed);
	    	}
	    	catch (Exception ee)
	    	{
	    		// if we have a problem, simply return null
	    		return null;
	    	}
	    }    Here produce an error -  This method must return a result of type RssFeed - How can i solve it?"
"6343299","7462562","2","Add `return` before `new RetreiveFeedTas()...`"
"5535672","7473304","0","Seeing the following on changing from Portrait to Landscape: java.lang.ArrayIndexOutOfBoundsException
       at android.text.StaticLayout.getLineStart(StaticLayout.java:1243)
       at com.groupon.view.AutoResizeTextView.resizeText(AutoResizeTextView.java:248)
       at com.groupon.view.AutoResizeTextView.onDraw(AutoResizeTextView.java:199)"
"4737265","7817067","0","I cant do the cast to LinearLayoutThatDetectsSoftKeyboard from my LinearLayout"
"5185587","8003427","0","Hi Manish, Thanks for the solution. Though Im facing a problem in using this. I keep getting 'no resource identifier found for attribute ttf_name in package com.lht.android'"
"5921190","8086381","0","Presumably this requires the permission to view running applications and services? Not ideal."
"3166551","8132083","1","This is density independent pixels not the pixels. And that 320 you see is 320dip not 320px. The calculation of px is different see this http://stackoverflow.com/questions/6840904/how-to-get-the-screen-size-of-the-device/6841335#6841335"
"3145655","8245929","0","Suggestion: we could also add a flag on timeout occur. Check [this](http://download.oracle.com/javase/1.4.2/docs/api/java/util/TimerTask.html#scheduledExecutionTime()). As GPS needs clear sky, timeout will occur often, if we user is not using network based location."
"2418314","8278177","2","Doesn't work for me - Nexus S. Tried before and after the show()."
"2418314","8290736","0","Doesn't work for me, either. My dialog contains a ListView and I add this listener from its Adapter."
"5535672","8328900","183","where is the donate button? Thanks man!"
"5535672","8391049","0","There is still a Bug with padding. You need to add return layout.getHeight()-getPaddingBottom()-getPaddingTop(); at the end of getTextHeight()"
"2418314","8487823","0","Doesn't work for me either."
"6763689","8505540","3","Thanks for this code, it worked very well. One wrinkle for other users: you will need to explicitly call setMaxLines(int) rather than just setting the property in XML."
"823966","8526210","0","See my answer below, I had same problem and got it working simply by calling a different BitmapFactory method."
"3419987","8529898","0","On HTC Desire animations still remain (at least when used in onConfigurationChanged method). They don't occur always, but using EboMike's code they also don't occur always."
"456941","8579737","1","@Harsha - to get around that issue, I chain my use of DateFormat so I only have to reference the Android class and therefore there aren't any ambiguous classes.

final String dateStr = DateFormat.getDateFormat(this).format(d);

You can use Android's format() method and have (IMHO) cleaner code and one less Object to instantiate."
"5535672","8650551","0","I don't think that is a bug actually. That method is trying to find the required height for the text. It then compares against the view height which has had its padding subtracted. Have you had any problems with this?"
"2131051","8968099","0","yes, the subsequently released Samsung tablets use built-in flash"
"3145655","9044735","22","This worked great for me!  However, the activity I used this for me checks location on resume.  If the user backs out of the activity before the location is returned the application would crash.  I fixed this by adding this method to your MyLocation class.public     void cancelTimer() {
    	timer1.cancel();
        lm.removeUpdates(locationListenerGps);
        lm.removeUpdates(locationListenerNetwork);
    }  I call this onPause() and that fixed the crash."
"6763689","9104912","1","Actually, it should be very trivial to map out these variables to XML attributes via attrs.xml."
"3419987","9116895","7","This doesn't work on the main activity started by the launcher. Your activity will end up hidden because of some of the flags set on the intent. Otherwise it works nicely."
"2636538","9160923","3","answered without reading the question.. -1"
"5921190","9197107","0","I didn't use such permission and it worked."
"6496013","9255681","2","When you do V.findViewById(R.id.someid),surely that will only work for all the widgets that are in the inflated view. What if the imageView he is trying to inflate is outside the inflated view?"
"2318356","9376244","116","+1 for intergalactic portability!"
"3495908","9386886","0","If I have list element with eg. `TextView` and in some cases it will contain two lines of text (or more) instead of one then height of whole `ListView` isn't measured correctly. Have solution for that?"
"2418314","9396604","2","@Stephen you can get the dialog from the builder by using `final AlertDialog dialog = builder.create()` and then `show`on the dialog instead of the builder."
"6496013","9451505","7","Then the class that ""owns"" and inflated the imageView needs to provide public access to it. That is very bad practice though. Fragments should only have access to the UI elements present in their layout."
"3145655","9496913","1","If both gps and network providers are enabled why not just use gps?"
