"2418314","9553422","0","That works very well - in some cases. For example, if you create a EditText in code and add that to the builder using setView, and then, after builder.create(), use your code above it works fine. **However, if I inflate a custom layout (that has a EditText), and add that to the builder using setView, and then try to attach the setOnFocusChangeListener to the EditText in my layout (after retrieving the EditText with findViewById), it won't work.**"
"2418314","9553726","21","**I RETRACT MY COMMENT ABOVE** I found out that if you can't get the focus right, take a look at your XML! If you see the tag *<requestFocus></requestFocus>* in there - remove it. It seems like the tag will give focus to the EditText, and then your listener will not be fired as the EditText already has focus."
"2636538","9573318","0","@hcpl Thank you for answer. Can you please tell me how to get multiple images...?"
"5535672","9706327","0","Chase, thanks for posting AutoResizeTextView!   I made a minor change and found a bug that causes a problem in the layout editor.  Because of the length of my response, I'll have to add it as a new answer to the original question; comments are limited in length..."
"6763689","9717688","6","i found a problem if workingText is Chinese. because Chinese doesn't have SPACE, so this code works not perfectly， i have modified some code below, hope will help.

    while (createWorkingLayout(workingText + ELLIPSIS).getLineCount() > maxLines) {
    //  int lastSpace = workingText.lastIndexOf(' ');
    //  if (lastSpace == -1) {
    //      break;
    //  }
    //  workingText = workingText.substring(0, lastSpace);

    // 由于我们大多数情况下workingText为中文，所以按照之前的逻辑找空格是不合适的
    // 这里改成直接替换最后的字符
        workingText = workingText.substring(0, workingText.length() - 1 - 1);
    }"
"5535672","9736662","0","Alan, thanks for the updates and glad this helped. I went ahead and added the check for `mTextSize == 0`. As for the measuring to fill a specific width, I didn't update my code yet because I want to have a more thorough look but it seems promising. Thanks!"
"2141166","9765274","5","How would this be implemented where mData is an object (e.g. JSONObject) and not an int?"
"2141166","9766463","0","Parcel has other methods for writing data types such as strings. In the case of a JSONObject you could put it back to JSON and write it as a String. If the object is Serializable and you don't have the access to make it Parcelable, maybe you could serialize it and deserialize it when you unparcel the top-level object? I haven't done this before, just a guess."
"5626213","9779946","1","<uses-permission android:name=""android.permission.READ_PHONE_STATE""></uses-permission>"
"1109108","9841249","3","did not work for me in 2.3. On one screen I did not have to do anything explicit to not get the keyboard to show up but on another having to do  do it. Joe's comment on this thread actually does the trick. http://stackoverflow.com/questions/1555109/stop-edittext-from-gaining-focus-at-activity-startup"
"6486348","9913949","0","doesn't work for me"
"8097801","9932534","3","If a two questions warrant identical answers then they are 99% of the time duplicates, so flag as dupes instead of posting the same answer on both. Thanks."
"5535672","9957579","0","A little enhancement that allows not only shrink text but also fit the layout can be found [here on github](https://github.com/serso/android_calculator/blob/master/src/main/java/org/solovyev/android/view/AutoResizeTextView.java#L221). Also I've found that sometimes algorithm works not very well for letters and i always append '|' symbol to the end of text, male calculations and then delete this symbol (can also be found in the sources from the link)"
"8097801","9969935","0","Its not 100% identical. The answer I provided contains code to actually attempt rooted commands, that would not prompt a Super User request to the user. Checking for test-keys does not work on all rooted devices (didn't work on mine). Testing for SuperUser.apk is also not perfect, users can uninstall it after gaining root."
"8097801","9970358","2","That may be so, however I am just letting you know that exact duplicate answers are **flagged** by the community. You should tailor your answers and address the specifics of the OP's problem. Copy and paste answers are at risk from attracting downvotes."
"559781","9977556","3","This code has several problems. Firstly you should cache Drawables, that will cause a memory leak: http://stackoverflow.com/questions/7648740/consequences-of-drawable-setcallbacknull . Secondly the cache itself is never cleared so it will grow forever, that's another memory leak."
"8097801","9991603","0","Thanks for the heads up, there is no reason why I would post an exact duplicate. My answer also includes code on how the Execute shell commands, which is useful in determining if the device running root."
"5921190","10086899","0","I needed a solution to this question as well, and ended up using this answer. Thank you geekQ!"
"6763689","10107999","18","Adding the following into the constructor will allow you to set the maxlines via XML:
TypedArray a = context.obtainStyledAttributes(attrs, new int[] { android.R.attr.maxLines }); setMaxLines(a.getInt(0, 2));"
"6763689","10160137","1","This screws up all the non-string attributes that the TextViews CharSequence holds. For example give the TextView a Spannable with bold text, and the bold is not shown."
"3495908","10167048","2","For solution by DoughW there is a bug, however i fixed it, see [my post](http://nex-otaku-en.blogspot.com/2010/12/android-put-listview-in-scrollview.html)."
"4847027","10212030","6","Note that the metrics (width, height) change depending on the rotation of the device."
"559781","10259295","1","@James A Wilson... where do i connect it with listview to show images as thumbnails??
m a newbie android dev... 
if someone could tell me plz"
"456941","10308800","5","This formatter only includes the date, not the time as the original question stated. Use DateUtils from the same package instead, see http://stackoverflow.com/questions/2983920/display-date-and-time-in-user-locale"
"4737265","10380248","0","+1, but what a pain... (I'm using the check in a functional test)"
"2418314","10439786","0","I find that if I have a dialog which extends AlertDialog and I try to show the dialog using `dialog.show()` after constructing the dialog object using the constructor. I am not able to see soft keyboard. However, if I switch to using `AlertDialog.Builder()` and attach my view to it using `Builder.setView()` all the EditText's in my dialog automatically show the soft keyboard when needed. I'm very perplexed by this behavior."
"4737265","10447722","0","This might be a stupid question, but how do I specify that my XML layout should be using this custom LinearLayout class??"
"5535672","10492433","0","Is there a lisence to that code or can I just use it?"
"5535672","10494395","97","In the spirit of Android, it's all yours! And hopefully when you build something that may be useful, you are able to share that :)"
"4737265","10513985","1","<view class=""foo.bar.RelativeLayoutThatDetectsSoftKeyboard""> ... etc..."
"3226743","10567717","0",":Thank you very Much.."
"2636538","10577741","0","small addition for device compatibility:
intent.setType(""image/*"");
if (android.os.Build.MODEL.startsWith(""HTC"")) 
  intent.putExtra(""folderType"", ""com.htc.HTCAlbum.ALL_PHOTOS"");"
"4464674","10600439","0","This isn't going to work properly. What about portrait images? Upside-down images? Using the exif data is much better."
"7875656","10613432","4","Thanks for combining all the feedback. I see that the solution takes **only width** into consideration. My problem is that the fond exceeds the height."
"7875656","10616259","3","Oh, it seems to partially work at runtime. On a device ot emulator, the text is cut half way up. On the Eclipse layout editor it looks fine. Any ideas?"
"5535672","10626347","0","This solution isn't working for me on the Galaxy Nexus.  It works great on my older Android devices though.  Unfortunately, I don't have time to debug this right now, but thought I'd let everyone know I'm seeing issues with Android 4.0.1."
"5921190","10630483","19","This answer should be marked as the right answer. Very elegant solution to the problem, and no permission is needed to perform it."
"3145655","10639594","0","@Fedor: Could you explain what's the usage of LocationResult? There were syntax errors with your usage code. I don't understand what's side effect of keeping this class abstract. Thanks for demo anyway."
"4325239","10655362","0","This does work great @EddieB...except that I have a preference screen within a preference screen.  Any idea how to reach the inner preference screen and populate those with summary?"
"4847027","10771670","4","Metrics will return the size of the display, but HoneyComb and up, your activity will have less space than what's returned due to the system bar."
"6486348","10860249","0","This worked great for me, thanks!"
"5535672","10867894","0","Looks like sometimes on the Motorola Xoom I'm running 3.1 or 3.2 there's an ArrayIndexOutOfBoundsException happening on the line containing ""int start = layout.getLineStart(lastLine);"" seems to be due to int lastLine being set incorrectly."
"5535672","10868788","1","Let me look into this in the morning. I don't remember why I was subtracting 1 from the result. That functions seems to be returning a 0 based line index. Could be a bug. I will update."
"5535672","10882798","0","I just took off the -1 and added a line that would only subtract one if > 0.  I'm working on fixing a padding issue with 3+ as well, not sure about 4 yet.  I'll share the code if it's relevant."
"5535672","10883050","0","The Padding issue I mentioned in the last comment isn't relative to AutoResizeTextField.  Great code by the way, next time you're in Ebisu I owe you a drink!"
"7596063","10884331","7","Works so far. Any reason why this isn't the best answer?"
"5535672","10906183","4","Ok, so I made an update to the code. Subtracting 1 from the line index was intentional and I added a comment. The error you got was probably from when there was not enough height to render even one line of text. I added a check and cleared the text in that case. (I work in Shibuya so I'd be up for a beer anytime :)"
"5535672","10906895","0","Perfect! As for that beer, Just tack my user name on to my website and shoot me a message with the subject beer."
"5535672","10907067","0","On another note, what's the reasoning behind using textPaint.setTextSize rather than the native setTextSize and a temporary TextPaint for the size checks?  I ask because it seems to have some issues in 3 when doing Gravity.CENTER and some other issues in 4"
"5535672","10907498","0","I assume by native you mean calling `setTextSize()` on the text view itself. Doing this does almost the exact same thing except also invalidates the layout. The reason you don't want to use some other temp `TextPaint` object is because you want to be sure to consider all the same formatting (font size, family, style, etc.) as the text view itself. Borrowing this text paint object seemed to be the most logically solution. I wonder what kind of issues you are having exactly on the newer platforms..."
"823966","10969366","0","The loop looks better with this change:

   while (tmpW > MAX_IMG_SIZE || tmpH > MAX_IMG_SIZE) {
            tmpW /= 2;
            tmpH /= 2;
            scale *= 2;
        }"
"823966","10969438","0","Also if you are dealing with streams you will have to request image anew after executing the first call or you'll get nothing"
"2636538","11002019","0","@hcpl +1 Thanks for good work"
"1109108","11004963","0","this causes the app to force close on android 1.5"
"5535672","11058113","0","What about using  TextPaint textPaint = new TextPaint(); textPaint.set(this.getPaint()); to pass the formatting?"
"5535672","11068905","0","You could, but I don't quite see the advantage. I am modifying the original text paint directly but I will be adjusting the font size any way so what do you gain from creating another object? Of course, if this solves some issues with 3 or 4, it may be worth looking into."
"7596063","11093102","5","because getLaunchIntentForPackage(""app package name"") may cause exception."
"2418314","11099842","0","Used this to fix a problem with EditText on FragmentDialog"
"151940","11113406","0","@Shaun, looks like you found out [after posting this comment](http://stackoverflow.com/questions/5412746/android-fragment-onrestoreinstancestate) that something equivalent to `onRestoreInstanceState` is also available to Fragments."
"3495908","11126357","0","It might be slow, but when you have a layout you have to stick to, this does the trick!"
"4464674","11126890","0","It works properly in one of my apps, but of course I have not tested all types of scenarios. @Timmmm could you please be more specific in what scenarios it does not work? I am also quite puzzled about you voting my post down. It seems to be a quite harsh response to an honest try to share a potential solution."
"4464674","11150988","0","I didn't mean to be harsh; sorry! I just didn't want anyone to copy your solution hoping it would work. As I said, it won't work for portrait or upside-down images. I will add the correct solution as an answer."
"8097801","11244772","0","Pardon my ignorance, but is it possible to detect a rooted phone without the ""reboot""?  TIA!"
"4464674","11250105","0","I see. I will add a comment highlighting your solution above as the prefered one."
"3427058","11257407","6","works in Android 4.0.1"
"5626213","11273433","0","@emmby +1 for posting this. What is the purpose of checking `if (uuid == null)` **twice**? (separated only by `synchronized (DeviceUuidFactory.class)`)"
"3419987","11278941","0","Good point.  makes sense because it calls finish() from the base activity in the stack."
"5626213","11293867","1","@ef2011 it's the double-checked locking pattern: http://en.wikipedia.org/wiki/Double-checked_locking"
"4737265","11307822","8","Seems to be doing the trick. Also, if you don't know the root view's ID, here's how you can get the view: `((ViewGroup) findViewById(android.R.id.content)).getChildAt(0)`"
"4737265","11309618","0","@Goldsmith: good one!"
"5273295","11314162","6","Don't forget the permission. ;)"
"2636538","11318616","0","@hcpl...  what if you wanted to drill down into the gallery to a specified directory programatically.  If the app creates a directory that shows in the gallery, can you just take the user directly to that gallery? handling exceptions of course.  I wouldnt want to show the user every directory and have them select, I just want to show them the directory that I want them to be in. You can email me if you want dapiechocki@gmail.com"
"5626213","11347920","3","Thanks for posting.  But what's to stop someone with a rooted phone from simply editing device_id.xml to put in a new UUID of their choice?  (i.e. to circumvent a 'free trial' check) Wouldn't it be better if the class only stored the value in a preference file if it has to resort to the random ID method?  Otherwise, there is no need to persist it between application runs; it's more secure to re-generate."
"9045507","11406717","0","there is also one other error to MB's answer and yours..If you use randomUUID as a deviceID and appID it works for all devices across the boord no matter if they are phones or not or if they are google exp devices or not."
"4737265","11429004","0","New answer is very helpful."
"4737265","11429623","0","Thanks for the update Reuben. This was indeed very useful. I will be posting an example project for this that will link to your answer and your profile."
"4737265","11520467","0","Thanks Reuben, i did try your way and it worked for me too but it does not work when i remove the title bar... any suggestion pls"
"5921190","11521236","52","Thanks for this solution. I'd like to add: Instead ""com.example.MyService"" is more elegant to use MyService.class.getName()"
"3916700","11566237","0","@danh32 What is PIC_WIDTH here???"
"3916700","11566307","0","this didn't work for me"
"3916700","11572013","1","PIC_WIDTH was a constant that I knew beforehand, since I was just displaying a single image from the assets folder. As I said above, I don't know how you can get the width of the actual webpage."
"6496013","11597416","1","This works perfectly, thanks a lot!!!"
"2591311","11754497","7","You should really mention that when using requestWindowFeature(), a force-close will occur if you execute this line after adding **any** content. And on a side note, the XML method is much safer and it also separates page structure from your code, (which is the _entire_ purpose of the XMLs in the first place.)"
"3145655","11760133","0","Copy-pasted this into my new Android app and it worked the first go. Thanks!"
"3495908","11837104","25","`listItem.measure(0,0)` will throw a NPE if listItem is a ViewGroup instance. I added the following before `listItem.measure`: `if (listItem instanceof ViewGroup) listItem.setLayoutParams(new LayoutParams(LayoutParams.WRAP_CONTENT, LayoutParams.WRAP_CONTENT));`"
"7827593","11848381","1","It was really helpfull for me. Thanks... But when receiving the passed object, the syntax Should be [ Deneme dene = (Deneme)i.getSerializableExtra(""sampleObject"");
 ] ... Is it ???"
"7827593","11864456","0","thank you and yes I've changed it :)"
"151940","11930545","0","Can we do this with objects?"
"151940","11973392","2","Im having some trouble with this on a stock X8. OnSaveInstanceState is NEVER called. Not when going back to home screen, nor when pressing back button to get to the previous activity and neither in the case of quitting the app. On destroyed is called, but not onSaveInstance state."
"823966","11980494","0","Another thing that helps is to call recycle() once the Bitmap is not going to be used anymore..."
"3495908","12045667","0","it is not slow, able to place 3 listviews with in a scrollview..."
"2418314","12071137","0","+ 1 its very useful for me."
"4105966","12126634","4","Here are all the rotation values for the different orientations: 3: 180, 6: 90, 8: 270"
"4737265","12142228","1","Hi, 

Your answer to this post helped me greatly but however, since listener gets called everytime(I don't know why.....) I can't do anything with the layout. For example, I inserted a Toast when Keyboard is showing then the Toast keeps on popping up which means listener is getting called all the time.... Is there anyway to stop this? Is this because I implemented listener on the activity not like the way you created it?"
"3145655","12175660","0","@Fedor can you tell me when i am using the network to find the location i found that while using the maps it is fetching very fast while in my application i am getting the location but little slower. its like while start the map it shows on the notification bar the fetching start instantly while in my application it start little later or some time not my timeout is 7sec to get either from network or from GPS."
"5535672","12206183","0","Instead of constantly redrawing and measuring the text on a canvas until you find the biggest size that fits, could you just draw it on a canvas with a size that is too big and save it as a .png and then draw the .png to stretch/shrink within in the size you want? You would want an original size that is close or bigger than the final size because shrinking a large image looks better than stretching a small image. Or would that method end up being more work and less efficient than just redrawing and measuring the text until it fits?"
"5535672","12207683","3","I believe that would not work for several reasons. Apart from being hard to implement, the resulting image would only be scaling the height since the width is generally determined and this code re-sizes the font until there is no more vertical overflow. Also, when scaling text images, you will most likely find the text to be blurry if the scaling does not happen on an exact pixel boundary. I find the rendering and remeasuring of text to be fast enough for all of my use cases. Have you experienced performance issues?"
"2418314","12210197","10","How do you not do this if the device has a hardware keyboard? Seems like this is annoying for those users."
"2131051","12233022","2","don't forget to add to the AndroidManifest.xml the right to write  http://stackoverflow.com/a/4435708/579646"
"9624844","12276908","0","The best solution that i found, thank you Helton Isac! Perhaps can you add (for a better solution) a check for the inchs of the screen? anyway, a 10 for this solution"
"9624844","12279072","3","I _really_ disagree. This is a method to find a certain screen size. Again, as I have answered, there IS NO difference between a tablet and a phone. This is not an answer to the question. It is not possible to differentiate because there is no 1 difference. If you need to code for certain features (like you seem to do for certain screen sizes), then do so, but do not call it tablet vs phone. Topic starter seemed to put the line @ certain tilt functionality. Read @commonware 's comment on the question thourougly."
"9624844","12302512","0","I do agree with Nanne, but as I said, in my Application I need to show two panels if the screen are large enough to do it. And I can't use layouts in this case, because the screen logic was in the Java side."
"3145655","12309780","1","In my case Fedor's code wasn't accurate at all without gps and I ended up using Commonsware location polling library (https://github.com/commonsguy/cwac-locpoll), which has given me much better results. I really don't know why, because both relay on the same basic code, but the accuracy improvement for network location is huge."
"4737265","12400069","1","Hi, if your original answer is based on this answer from 2010 { http://stackoverflow.com/questions/3409737/android-soft-keyboard-how-to-manipulate-views-on-keyboard-on-off/3422453#3422453 } then a credit is due. If not, then great minds think alike :)"
"4737265","12400376","0","@OferR : It wasn't."
"2318356","12429936","6","Is this line of code 
`mAccel = mAccel * 0.9f + delta; // perform low-cut filter`
supposed to be `mAccel = mAccel * 0.9f + delta * 0.1f; // perform low-cut filter`?"
"559781","12601943","1","this causes images to get the wrong image sources in a listview.  For example I have icon 1 , 2, and 3.  My list shows icon 1 and two 3 icons when using this drawable manager class.  Does anyone know how this is fixed from this exact code above?"
"3292810","12606225","0","can the 'color' be transparent color, George?"
"823966","12631346","0","why do you further divide `o.outWidth / scale` by 2?"
"4847027","12639108","2","@Guy it depends on your implementation. You can hide the status bar: 		requestWindowFeature(Window.FEATURE_NO_TITLE);
		getWindow().setFlags(WindowManager.LayoutParams.FLAG_FULLSCREEN, 
				WindowManager.LayoutParams.FLAG_FULLSCREEN);"
"2318356","12666048","1","Nice one!
I've also added a check to avoid shakes too often (in my app I've set it to 750 ms after the last shake)...


    `Calendar last = Calendar.getInstance();  
    Calendar now = Calendar.getInstance();  
      
    last.setTime(last_date);  
    now.setTime(new Date());  
      
    long diff = now.getTimeInMillis() - last.getTimeInMillis();  
      
    if(diff >= 750)  
    {  
        ...  
    }  `

Method names should be correct (I don't have the code with me...)"
"8272212","12679183","0","I only required the decimal places validation, for dollars entered, here is my regex: [0-9]*+((\\.[0-9]{0,1})?)||(\\.)?"
"4894936","12733658","21","assuming an extension exists, I would rather use filename.substring(filename.lastIndexOf('.') + 1) to get the extension. Using regular expression for something simple like this is overkill (and it's slower)."
"4894936","12734038","0","rrrrrray, you know what they say about assuming..."
"4894936","12734305","5","The point I am trying to get across is to not use regular expression for a simple task like this, not error checking."
"151940","12767303","0","It has been a while, but I wonder if something like this is possible with appwidgets? I am having this issue http://stackoverflow.com/questions/9624940/appwidget-keeps-reseting-background-to-transparent and the solution I now have, using a service to listen for events feels a bit like a cludge."
"3226743","12795710","13","You can even use..  ""moveTaskToBack(true);"""
"3145655","12821912","1","How to get the location with this piece of code ? Show me just how to toast it or seomthing."
"9624844","12984698","2","Helton,  thx for this.  Thought I'd say that this returns:
Kindle Fire : false, Moto Xoom (v1) : true, Galaxy Note : false, Galaxy Tab 10.1 limited : true"
"6763689","13004299","21","I created an Android library with this component and changed it to be able to show as many lines of text as possible and ellipsize the last one; see https://github.com/triposo/barone

You can see it in action in any of our travel guides, when displaying Suggestions: https://play.google.com/store/apps/details?id=com.triposo.droidguide.world&feature=search_result"
"5535672","13017239","0","Has anyone made a fix that works on tablets?  This auto resize only seems to work on smart phones.  Thanks for all your hard work though!"
"4737265","13030014","3","increased if (heightDiff > 200) to 200... 100 didnt work for me
tested it on QVGA (wildfire etc) devices, works as well .. :)"
"5535672","13045198","0","I am using this on tablets without any issues. What kind of problems are you having? Keep in mind that certain layouts such as Relative layouts with wrap content settings will not constraint the size and the text resizing will not work."
