"11656129","27089420","2","Shouldn't be very hard? I'm out of Android programming right now, so correct me if I am wrong. You could somehow track the focused EditText at any moment, and just request it to lose it's focus during an OnTouchEvent ?"
"7875656","27158889","3","This was a great solution! In case anyone else is new to android development and doesn't quite know how to implement an extended view in XML, it looks like this:
 
`<com.example.zengame1.FontFitTextView
         android:paddingTop=""5dip""
        android:id=""@+id/childs_name""
        android:layout_width=""fill_parent""
        android:layout_height=""0dip""
        android:layout_weight=""1""
        android:layout_gravity=""center""
        android:textSize=""@dimen/text_size""/>`"
"11656129","27172413","0","Thanks ! You are awesome"
"5535672","27196576","0","Will the above work for this issue: http://stackoverflow.com/questions/18497760/having-an-issue-with-textsize-within-textview"
"3495908","27221377","0","i donot know why it takes to much height bcz my list view element height is 70 and when print this line listItem.getMeasuredHeight() it show 316 so im confused"
"7827593","27330393","0","thanks Mustafa Güven:)"
"9288544","27357895","3","The input stream is not closed in your example. Best done in the finally block of your try/catch."
"11656129","27394194","0","Navneeth. It worked for me, thanks.."
"9127423","27395740","1","You can see [my answer](http://stackoverflow.com/a/18612147/1088643). It replaces fragments and return back to first one."
"3427058","27412004","0","@emmby Can you add an example of how to use this? I have created a spinner in the Graphical Layout that I usually get a pointer to with Spinner spinner = (Spinner) findViewById(R.id.spinner1); - how do I make it use the NoDefaultSpinner behavior?"
"3427058","27544428","2","@DavidDoria You have to use the NoDefaultSpinner class in your layout file. Copy the source from above into your project, e.g. into package com.example.customviews. Now in your layout xml, instead of <Spinner ...> use <com.example.customviews.NoDefaultSpinner ...> The rest of the code can stay the same. Don't forget to add the android:prompt attribute to the <com.example.customviews.NoDefaultSpinner> view in your layout."
"7827593","27617299","1","@AliHassan you are welcome"
"4105966","27624876","11","Watch out of `OutOfMemoryError` when use this approach as you hold two bitmaps in memory at the same time."
"5921190","27744378","1","This code is incorrect/incomplete. It also needs to check for the package name, as currently there is a chance you'll find services from other packages rather than your own."
"13381228","27749260","0","@acntwww This is due to displaying all the child views each time. Hide all child views using View.GONE just before starting the animation and change back to VISIBLE once animation finishes (interpolatedTime == 1). This also gives you a nice fade-in effect."
"15612964","27846702","3","This fails on devices that doesn't have 2 SD cards. It assumes 1st found is internal, and 2nd found is external..."
"5626213","27850992","1","Why didn't you make this class final - and also ""static"" (in the sense that all its methods can be static, and its constructor private) ? Also different apps using this class might very well get different IDs in the fallback case - they read an write their _local_ copies of `PREFS_FILE`. Moreover @Peterdk is right - you might get a NPE on say a tablet with id `9774d56d682e549c` - right ?"
"12439378","27879592","0","works like a charm !!"
"14364222","27900409","0","Note that if you're using ActionBarSherlock the view IDs will be different.  For example, the lib currently sets the edit text ID to ""package:id/abs__search_src_text"", which can be accessed directly via R.id.abs__search_src_text."
"14364222","27901240","2","Also, what I actually wanted to change was the SearchView hint text color, which is done easily via textView.setHintTextColor()."
"4105966","27933562","5","9re posted this util class https://gist.github.com/9re/1990019"
"13381228","27944314","1","@OferR I don't see any improvement when using View.GONE for the children. The animation is still very slow!"
"6343299","28023360","0","Does this have to be implemented as an inner class of the class you are calling ""new RetreiveFeedTask().execute(urlToRssFeed);"" from, or can it be its own separate class?"
"6343299","28040332","1","^Yes, it must be subclassed.  That is, you are not creating it in its own separate class file."
"13381228","28095071","1","@acntwww You can get a smoothly animation multiplying the duration by some factor, like 4. `a.setDuration(((int)(initialHeight / v.getContext().getResources().getDisplayMetrics().density)) * 4)`"
"13381228","28136029","9","What is Transformation t I'm not finding that type anywhere"
"9288544","28182971","0","@Blundell not a problem really because your com is for the most part serial too.  Try downloading two big files on your desk.  Each slows down the other. In the end it will take just as long to get the data."
"1109108","28281460","2","It may be helpfully to call editText.clearFocus() before hiding the softInput"
"4325239","28482510","0","@taraloca - change
  if (p instanceof PreferenceCategory) {
    PreferenceCategory pCat = (PreferenceCategory) p;

to

  if (p instanceof PreferenceGroup) {
    final PreferenceGroup pCat = (PreferenceGroup) p;"
"13381228","28500955","2","Although it work, but not smoothly. Tweaking the duration doesn't fix the smoothness."
"3145655","28515598","0","@Fedor i see that you consider as good enough the first location that you get, but what if its not? Also, you don't do anything with the other 3 methods from LocationListener.. shouldn't you take them into consideration? Thanks, im new to Android."
"823966","28598865","1","I usually set `options.inPreferredConfig = Bitmap.Config.ALPHA_8;`. With this setting, each pixcel will be save by 1 byte instead of 4 bytes as default."
"13648873","28702047","1","I've tested on some Motorola, Samsung and LG devices and it worked perfect."
"11656129","28829519","0","Not working on android 4.1"
"11656129","28830921","0","Really Jagdeep? I've done this for 4.1 I think, using the same approach. Which part of the solution do you think is causing the problem for you?"
"3916700","28952295","0","but how about height? Do Android tablets have same ratio?"
"5185587","28992990","0","A nice step by step tutorial http://kotikan.com/blog/posts/2012/09/android-attributes to use together with this answer"
"3226743","29039640","5","This keeps your app in the background, so it does not exit the application."
"5106399","29044398","1","Complete n00b question: What happens on devices with physical keyboards, is the soft keyboard shown as well?"
"11656129","29329254","2","Not sure if anyone else has run across this issue, but this causes the app to crash when you call hideSoftKeyboard if nothing is focused. You can solve this by surrounding the second line of the method with `if(activity.getCurrentFocus() != null) {...}`"
"5535672","29357414","3","does not work for TextView inside ListView Items as well as inside Include other layout"
"4737265","29494991","0","I use a similar set up - but your setup doesn't allow for Chinese and Japenese keyboards who's ""suggestion"" rulers (which are required) make the screen area grow and shrink by more than 100 (Nexus 10). Instead, where possible, try and use ScreenHeight / 4 as the ""fudge"" value, as in all instances we've found a keyboard takes up at *least* 1/4 of the screen and any ""suggestion bars"" take up less than 1/4. (Remember to add an onOrientationChange method to reset the 1/4 value)."
"13381228","29639475","0","I guess that your best bet to get it smoother is to simplify your views. I'am not shure there is any better solution :/"
"3145655","29687573","0","@Fedor Dear Sir, I am using(your code) like this is this(http://pastie.org/8476712) correct way ? Please tell me."
"2141166","29688541","0","bad design, just sayin"
"2091482","29707089","0","Please be aware that the documentation points the following: Add extended data to the intent. The name must include a package prefix, for example the app com.android.contacts would use names like ""com.android.contacts.ShowAll""."
"5921190","29777771","0","I think static field is a better solution. if a service bound in an activity this method returns true whether service not started yet."
"8272212","29826868","0","it don't allow to change digits before decimal after user have entered 2 digits after decimal point."
"5535672","29907668","0","Thanks! I've changed the implementation a bit but the idea is great!"
"7875656","29932618","0","Good answer (but not good enough to get selected?). Should also implement the third constructor for TextView as shown here: file:///Users/andrew/android-sdk-mac_x86/docs/reference/android/widget/TextView.html"
"12345118","29951968","0","It's the reflection Field, so `import java.lang.reflect.Field`"
"2636538","29989196","0","@gcl1 the getPath() method is a custom helper, don't forget to add it to your code. It will use a content provider if possible and fall back on the uri.getPath() function if not."
"2636538","29989241","0","@Noby check my updated answer, it has some info on how to select multiple images on API level 18 and higher. Before that you'll have to provide your own media browser or look for an open source library."
"2636538","29989410","0","@Khobaib Thanks for the update. I've added a pointer in my answer."
"5535672","30016233","0","In the past when creating custom views I have had problems when the second constructor calls the third constructor with 0, and it calls super() with 0 for the style int. What I did was call super() with 2 params in the second constructor, and also call getTextSizeDirectly(). Same for first constructor."
"15612964","30068348","0","Thanks for this @Richard, and thanks for the caveat Caner."
"6200598","30110100","1","when I am trying in my custom row its not getting why?  String s1 = ""<b>You are at:</b>""; holder.address = (TextView) convertView.findViewById(R.id.address_text_view); holder.address.setText(Html.fromHtml(s1)+ track.getAddress());"
"2636538","30262927","14","Getting a single picture doesn't seem to be working on the newest Android version 4.4 (KitKat) anymore. The _data column from the query returns a null value."
"1109108","30290480","9","Calling `editText.clearFocus()` then `InputMethodManager.HIDE_IMPLICIT_ONLY` even works on `4.1`"
"14167949","30372566","3","Great answer ...."
"3145655","30380672","0","@Fedor how can i get New latitude and longitube values after every 5 seconds? where to update the code? please help"
"3226743","30504786","0","@HermanSchoenfeld: yes, exactly, I am totally agree with you"
"5535672","30518003","0","For @annie and @metalurgus and all those that have problems displaying this `TextView` extension in `ListView` items, I found [this implementation](http://stackoverflow.com/a/7875656/22904) to work, albeit with a slight modification to avoid scaling up the text size."
"5535672","30603187","0","I'm trying to use this, but it doesn't quite seem to work. It shrinks a text that's too big, but not quite enough to fit in the last word. I'm setting the line count to 2. Is that maybe what the issue is?"
"6343299","30676147","0","@AndroidDev Can your first statement be confirmed by trusted sources? I thought that AsyncTasks were really useful tools."
"5535672","30694583","0","I am seeing the same issue as @Bobbake4 on a 4.1 device.  The text scales but only displays what would have fit had it not scaled down.  Also never shows ellipses."
"5535672","30696287","1","I made two changes to get it to work, removed textHeight > height check and set the text at the end: if (mAddEllipsis && targetTextSize == mMinTextSize) {...} else { setText(text); }"
"5535672","30699246","0","I'm now trying to get the text to center vertically after it resizes and have tried damn near everything.  Any suggestions?"
"4737265","30735784","1","I suggest you use dp and not pixels. I personally use >100dp."
"823966","30766652","0","guys how do you upload the resized bitmap?"
"3035869","30793315","1","not working for layer-list on 4.2"
"8097801","30825601","5","Just wanted to let you know, the Fox Digital Copy (Beta) app uses your code nearly verbatim, including the Root and ExecShell classes, as well as the checkRootMethod1/2/3 methods. Found it highly amusing."
"8097801","30834971","0","I can sue them like Fox sued countless others?"
"2636538","30863483","0","@Chsristopher Masser, Any suggested alternative for Kitkat?"
"13381228","30881528","0","Where do I have to call the expand/collapse methods? If I call them inside getChildView and getGroupView , animates the hole group. Is there any way to call them inside the listeners onExpand and onCollapse and animate only the expanded/collapsed group?? Thank you
@TomEsterez"
"14167949","31026136","0","does this work for Android 2.2 and up?"
"151940","31049282","0","@schlingel +1 for mentioning that onSaveInstanceState() is not part of the life cycle. I think it's not called when the 'Back' button is pressed. It's called only when 'Home' button is pressed."
"559781","31070395","0","I think the code example didn't handle recycled views correctly. Did it?"
"19854415","31194665","0","Does one need to know the uri of the image here?  What if I just want to pick an arbitrary image from the gallery?"
"2636538","31195022","0","@hcpl  You didn't mean 'Intent.hasExtra', you meant 'data.hasExtra' - assuming data is your Intent parameter in onActivityResult()."
"5097838","31197759","0","Make sure you are not filtering out debug log statements."
"151940","31222087","0","@RetoMeier - When is savedInstanceState == null and when is it not null ?"
"151940","31226265","0","@Trojan.ZBOT when there's a saved instance state it's not null and when there isn't it's null ;-)"
"151940","31240481","0","@schlingel - yes. but when do we get a saved instance state ? Always ? On rotation of phone ? On pressing home button ? Etc ? that is my question. I am a beginner, so i don't know these things."
"19854415","31251538","0","Intent which you will receive from the gallery will provide you the url"
"13381228","31326960","0","This won't work on newer APIs, Use `LayoutParams.UNSPECIFIED` when measuring a View not added to layout."
"823966","31344715","1","@Dopyiii FYI *=2 is equivalent to >> 1, not >> 2"
"6486348","31363071","1","If this still doesnt work, try this solution http://stackoverflow.com/questions/8100831/stop-scrollview-from-setting-focus-on-edittext"
"14167949","31421646","1","@newton_guima yes, it does work. Just remember to use supportRequestWindowFeature(Window.FEATURE_ACTION_BAR)"
"6343299","31423928","0","@AndroidDev: Can you please provide an example of Runnable where we can wait for the response and then carry the rest of the task in the UI thread? I tried to look for examples, but couldn't find any that did it all. The problem in Runnable thread is that there's no thread finished event."
"4737265","31591785","0","But it's not working with me. i have 4 edittext on my activity. if i click on any edittext then it scrolling up but i want to scroll up screen when i click on any specific edittext"
"4737265","31592364","0","@ReubenScratton  can you take a look at it.  http://stackoverflow.com/questions/20885086/screen-scrolling-up-when-clicking-on-any-edittext"
"11656129","31600396","0","nice solution :D"
"151940","31726660","0","It works but cn it also work for dynamic data"
"4009133","31842683","0","@midnight u right same thing i am facing my internet is on but data packet are not sending nd recievint then in this situation what ca we do?"
"13381228","31920210","0","I changed the duration to 500; I have a view of 30dp height, worked very well, thanks !!"
"7875656","31952833","0","Good solution. If you need really big text size for very large screens, increase the initial value of `float hi`."
"8097801","31988603","0","Is /system/xbin/which installed when the device is rooted? I could not find it on the emulator. But /system/xbin/su is there."
"3145655","32033834","0","I've used this solution as a base to my own implementation. To avoid potential sync issues such as the one raised up by differenziale, I would suggest to not use `Timer`s and use `Handler`s on the caller thread.
http://android-developers.blogspot.com.es/2007/11/stitch-in-time.html"
"5097838","32054800","0","This code is working however, do you have any idea on how to put those list of application in a ListView?"
"6343299","32062135","0","@Griddo re AndroidDev's statement: Each _instance_ of AsyncTask should only be executed once, but that's not a reason to avoid them - just create a new instance for each execution. If you want reasons to be wary of AsyncTask: watch out for short-term memory leaks created by the implicit reference to the Activity if you make your AsyncTask a non-static inner class of the Activity; watch out for different execution characteristics pre/post Honeycomb due to the sizing of thread pools."
"5097838","32140439","0","@androidBoomer im doing the same. read this here - http://www.vogella.com/tutorials/AndroidListView/article.html"
"5097838","32141343","0","@DavidT. I already figured it out. Now, I'm working on how can I access those installed app in order to create a shortcut inside my App. Is that possible?"
"3427058","32148258","0","How can the Font of Drop Down items can be changed ??????"
"5097838","32176520","0","@androidBoomer i think so. you should be able to get each app's icons, and then launch them based on the intent that they specified to accept. you can ask as a question, and tag me for me to answer. i don't have much space here (commenting) to answer."
"11656129","32179209","0","Exactly what I was looking for. Thank you!"
"3916700","32187985","1","Only this solution works fine on Android 4.4"
"5097838","32228302","0","@DavidT. here's my question. I really need your help. http://stackoverflow.com/questions/21371491/create-app-shortcut-inside-the-custom-launcher-in-android"
"3495908","32370536","0","am using the above code and it is working fine but footer is missing from the view...How can i fix this."
"4009133","32405695","2","I agree with midnight and Pintu, this answer should not be the accepted answer, it has nothing to do with checking wether you're on the internet. For example, if the phone is connected to a WiFi network with a captive portal, like at a hotel, this function will incorrectly return true. The correct answer is to ping a server on the public internet."
"2636538","32486539","1","This code is working perfectly preKitkat, but from then there are document providers. In my answer I write about what to do in kitkat."
"1109108","32498343","1","what also can help, is to wrap this code into runnable and postDelayed to getCurrentFocus() View"
"13648873","32499845","0","Did NOT worked for USB devices attached through OTG cable on Nexus 5 and Nexus 7."
"15612964","32499889","0","Did NOT worked for USB devices attached through OTG cable on Nexus 5 and Nexus 7."
"3916700","32671270","0","http://stackoverflow.com/questions/21620732/html-data-not-display-correct-in-webview-gettinng-from-json-webservice-in-androi/21620839?noredirect=1#comment32670624_21620839 can you help me /"
"4325239","32697981","0","this is working great what if `EditTextPreference` is `android:password=""true""`  it shows the value"
"5185587","32780567","0","This is of course a valid solution, but if you've already created a custom class, why not just set the typeface right in the constructor? No need to play around with custom attributes."
"6070857","32796936","0","enter key is still working in nexus with linear layout"
"6070857","32801793","0","@Dr. aNdRO Which version of Android?"
"6070857","32803557","0","Kitkat 4.4.2 android"
"3145655","32977978","0","If you forget to add the **USES-PERMISSION** you are going to have a bad time."
"2131051","32986954","0","Works perfectly in api 19"
"4009133","32993925","4","when there is no working internet for my router, if I connect to router through wifi, then the above code is returning true. But, It is not supposed to be, right? Can you help me"
"6496013","33012621","0","Note that findViewById has to be called on the view that is inflated, not on getView()"
"4618185","33026219","0","can you explain what res.getDrawable res what it does ?"
"5921190","33065301","3","-1. This method is not really sustainable. It does not work on Android KitKat."
"16879984","33074594","0","doesn't work with Android 4.03"
"4847027","33162640","0","final float scale = getResources().getDisplayMetrics().density; int width = (int) (metrics.widthPixels * scale + 0.5f); - You have to account for device density when doing it that way."
"3145655","33210900","0","I tried both providers turned on in my htc one s, but it goes inside that,    if(!gps_enabled && !network_enabled){
        	 Log.v(""Ansar"",""""+""Nothing Enabled"");
            return false;
        }          ,why this?"
"11656129","33297788","0","I think hideSoftKeyboard(); should be hideSoftKeyboard(YourActivity.this); in public boolean onTouch. Anyway this snippet helped me a lot!!!!! Thank you!"
"15612964","33394979","1","/system/etc/vold.fstab is not accessible in android 4.3+"
"5106399","33658202","0","@Phillip just make sure to call this BEFORE you call Dialog.show() and it works real good using SOFT_INPUT_S‌​TATE_VISIBLE"
"13648873","33728628","0","@KhawarRaza, this method stopped working as of kitkat. Use Dmitriy Lozenko's method, with this as a fallback if you are supporting pre-ics devices."
"4737265","33746910","2","Notice: not working with WindowManager.LayoutParams.FLAG_FULLSCREEN and with a full screen theme."
"14167949","33804984","0","@Cleric - How do you make all this to work with `setTheme`? Because your answer works great if I set the theme from the Manifest, but if I do it in `onCreate` (in my case the theme depends on a preference for light of dark theme) the default holo action bar flashes before the one I set in my theme anyway. But maybe this is worth another complete SO question."
"2141166","33941808","0","@likejiujitsu See this answer: http://stackoverflow.com/a/4914799/76835"
"2141166","33945595","0","this does not work. see https://code.google.com/p/android/issues/detail?can=2&q=&colspec=ID%20Type%20Status%20Owner%20Summary%20Stars&groupby=&sort=&id=6822"
"14167949","33947115","0","@dentex There is no problem to set your own theme with `setTheme` in `onCreate` and _still_ use the one defined in the Manifest. In other words, the Manifest theme serves _only_ to disable the ActionBar and hide the TitleBar _before_ `onCreate` is reached."
"14167949","33967397","1","@Cleric Thanks. I resolved my issue setting `android:theme=""@android:style/Theme.NoTitleBar""` into the Manifest and then `setTheme(R.style.MyTheme)` in main activity's `onCreate`; This ensures (in Android 4+) avoiding the flash of the default holo `ActionBar` before the one I defined in my theme (I arrived here looking for a way to workaround this; I actually don't need any splash-screen)."
"4737265","33980305","0","@PaulLammertsma And even with DP, 100 is too small — 200 may be more safe choice."
"22372292","34008137","0","this works for me hope this works for you too"
"6763689","34009534","0","Doesn't works when doing textview.setMovementMethod(LinkMovementMethod.getInstance())"
"7875656","34035358","0","Any way to only resize if the text exceeds the parent width? For example I don't want to increase the size of the text if it fits in ok."
"5185587","34040840","0","@AlaksiejN. in case you need to set different typefaces to different TextViews..."
"3292810","34195866","0","supperb.....thnk you...:)"
"2141166","34286415","1","@ceklock the reason behind this is as follows: When the activity goes behind and later killed from the memory, and then when user opens it from the recents menu, it has to create the Activity where it left off. It has to be the same UI. The Object is not in the memory in this case. But the intent is."
"15612964","34309970","0","This worked well for going between Samsung tablet and PQ Labs iStick."
"439486","34380852","0","how's that working on KitKat?"
"2644266","34394881","1","@SteveHaley, No it is possible to hide it using the following line `dialog.requestWindowFeature(Window.FEATURE_NO_TITLE); `"
"3427058","34421994","1","To prevent the spinner from resizing itself don't use the entries property in the XML and do it via Java with something like this 

`private ArrayAdapter<CharSequence> createSpinnerAdapterFromArray(int arrayResource){
       ArrayAdapter<CharSequence> adapter = ArrayAdapter.createFromResource(getActivity(), arrayResource, android.R.layout.simple_spinner_item);
       adapter.setDropDownViewResource(android.R.layout.simple_spinner_dropdown_item);
       return adapter;
    }`"
"1109108","34469463","0","I have more than one edit text box in single xml layout. so at that time what can i do?"
"4325239","34562055","0","How should I modify the code to display summary from the resource (xml) file if no value is defined (i.e. `if editTextPref.getText() == """"`)? How to get summary value at `updatePrefSummary`? `p.getSummary()` and `editTextPref.getSummary()` return already modified values."
"5106399","34614996","2","not working (android 4.2)"
"5323437","34741368","0","How would you hand devices like Nexus 7 that reports densityDpi as 213?"
"5921190","34743033","0","Calling `bindService` with `0` as flag does not start the service, but this method identifies it as running."
"5323437","34747090","0","have if-else hand check between density value like, if (metrics.densityDpi > DisplayMetrics.DENSITY_LOW && metrics.densityDpi < DisplayMetrics.DENSITY_MEDIUM)"
"5323437","34747509","0","OR if (metrics.densityDpi < DisplayMetrics.DENSITY_LOW){} else if (metrics.densityDpi < DisplayMetrics. DENSITY_MEDIUM){}....."
